{
  "topic": "한양도성 각자성석",
  "verdict": "pass",
  "conditions": {
    "twist": true,
    "failed_alternative": true,
    "numbers": true,
    "present_link": true
  },
  "facts": [
    {
      "id": "f01",
      "claim": "1396년 태조가 한양 둘레 18.6km 성벽 공사를 시작했다",
      "numbers": ["1396년", "18.6km"],
      "source": "실록 태조 5년 1월",
      "confidence": "high"
    },
    {
      "id": "f02",
      "claim": "1396년 1차 공사에 동원된 인부는 약 11만 명이었다",
      "numbers": ["11만 명"],
      "source": "실록 태조 5년 1월",
      "confidence": "high"
    },
    {
      "id": "f03",
      "claim": "성벽은 97개 구간으로 나뉘어 각 구간에 담당 지역이 배정됐다",
      "numbers": ["97개"],
      "source": "실록 태조 5년 1월",
      "confidence": "medium",
      "notes": "구간 수는 사료에 따라 차이가 있어 보수적 값을 취함 (스키마 검증용 픽스처)"
    }
  ],
  "twist": "성돌의 이름은 낙서가 아니라 국가가 새기게 한 책임 표기다",
  "failed_alternatives": [
    "감독관 배치 (11만 명/18.6km 감시 불가)",
    "포상제 (부실이 수년 뒤에야 드러남)"
  ],
  "present_link": "흥인지문 옆·낙산 구간에서 각자성석 실견 가능",
  "notes": "테스트 픽스처. 수치는 specs/06-topic-research.md의 예시를 기반으로 한다."
}
